{
  "schemaVersion": 1,
  "id": "know-your-dance-print",
  "title": "Your Know Your Dance keepsake",
  "layout": "wide-polaroid-triptych",
  "page": { "size": "A5", "orientation": "landscape", "dpi": 300 },
  "grid": { "cols": 3, "rows": 1 },
  "marginPct": 0.045,
  "gutterPct": 0.025,
  "background": "#fff7e8",
  "order": ["maskVar1", "original", "maskVar2"],
  "labels": {
    "maskVar1": "Mask Variation 1",
    "original": "Original Portrait",
    "maskVar2": "Mask Variation 2",
    "mask": "Dance Mask"
  },
  "labelColor": "rgba(20,20,20,0.72)",
  "frame": "assets/frame.svg"
}
